Título,Descripción
Feijóo convoca el congreso del PP en julio en Madrid,El líder popular decide adelantar un cónclave en el que la oposición relanzará su alternativa de gobierno&nbsp;
El PSOE ve el congreso del PP como oportunidad para renovar el “liderazgo fallido” de Feijóo,"Sánchez evita en la reunión de Ferraz toda alusión a sus antiguos mensajes con Ábalos, y por ahora descarta denunciar la filtración: “No queremos darle más pábulo”, advierte la portavoz de la ejecutiva, Esther Peña"
Salvador Illa abre la puerta a reunirse con Puigdemont: “Buscaremos un momento para vernos”,El presidente de la Generalitat prevé presentar una propuesta sobre El Prat “idealmente antes del verano”
Puigdemont liga el apoyo al Pacte per la Llengua a la oficialidad del catalán en la UE,El líder de Junts pide esperar también la sentencia del Tribunal Constitucional sobre el 25% de las horas lectivas en castellano
EE.UU. y China acuerdan una gran reducción en los aranceles por 90 días,Las tarifas quedarán en el 30% para China y el 10% para EE.UU.
Zelenski ofrece un cara a cara a Putin,El presidente de Ucrania insiste en exigir a Rusia un alto el fuego a partir de este lunes
León XIV mantiene una conversación telefónica con el presidente de Ucrania,El Papa inquiere a Volodimir Zelenski por la paz y el regreso de los niños deportados por Rusia
Martínez Lacambra a la Fundació Cellex y el Liceu encara el fin de las servidumbres,"El caso judicial por irregularidades en la Fundació Cellex avanza, mientras que el Consorcio del Gran Teatre del Liceu plantea revisar los acuerdos con la Sociedad de propietarios"
Lutero en Santa Maria del Popolo,"León XIV pertenece a la orden agustina, escenario de la gran escisión en el cristianismo"
León XIV reclama una paz justa para Ucrania y exige el alto el fuego en Gaza,El nuevo pontífice lanza su llamamiento a los líderes desde el balcón de San Pedro
La gran resistencia,
El ascenso deplorable del catolicismo MAGA,
El Barça pone vista para sentencia LaLiga masculina mientras remata la femenina,"<a href=""https://www.lavanguardia.com/deportes/fc-barcelona/20250511/10669877/barca-madrid-flick-liga.html"">El Barça se levanta para rematar al Madrid y tiene la Liga a tiro tras un partido para la historia</a><br />"
De Messi a Lamine,El renacer del Barça en una icónica foto
La prensa ya ve campeón al Barça y menciona el polémico arbitraje ante el Madrid,"El triunfo blaugrana en el clásico&nbsp;acapara no sólo las portadas de los diarios deportivos, sino también de la mayoría de los generalistas y la prensa internacional se hace eco"
Brasil ya anuncia a Ancelotti; Xabi Alonso entrenará al Madrid en el mundial de clubes,"El todavía entrenador del Real Madrid dirigirá a la 'canarinha' a partir del primero de junio, pero terminará la Liga con los blancos"
"IA, nuevos operadores y guerras ponen el sector energético en el foco de los hackers",La NSA y el Foro Económico Mundial advierten del riesgo creciente en el sistema
"Gamificación, 'headhunters', y eventos: las estrategias del cibercrimen para reclutar jóvenes",El crimen organizado necesita más hackers y ahora tiene departamentos de Recursos Humanos
El 55% de los profesionales de la ciberseguridad que se contratan en Catalunya son extranjeros,La inversión internacional en el sector se ha multiplicado por nueve en el último quinquenio
Abanca niega “interés” en una unión con Sabadell tras pedir el Gobierno al banco catalán una fusión,La entidad gallega sostiene que “solo participaremos en operaciones que garantizan la preservación de nuestro modelo de gobernanza y nuestro modelo de negocio”
El Fiscal pide 107 años de cárcel para un electricista que violó y ofreció a una niña de 12 años,"El acusado es un electricista de 40 años, con antecedentes, que captó a una joven vulnerable y la ofreció a al menos dieciséis hombres para que la violaran mientras él lo grababa"
Cómo la tecnología integrada transforma nuestra vida,"¿Imaginas controlar toda tu casa desde el sofá, con solo tu voz o un toque en tu móvil? No es ciencia ficción; es el presente. Los hogares inteligentes están transformando por completo la manera en la que vivimos y cada vez más familias están dando el salto a la conectividad total"
"La UB descarta acoso, pero sanciona a un profesor por intentar lograr favores sexuales de una alumna","El profesor, apartado desde septiembre de 2023, está sancionado con año y medio de suspensión de empleo y sueldo"
La variante de Sant Boi acaba con una provisionalidad alargada durante lustros,Los coches empiezan a circular por el primer tramo de la nueva autovía B-25 abierto al tráfico
Barcelona calienta motores electorales,
La jueza de la dana rechaza que declare la periodista que comió con Mazón en El Ventorro,"La instructora señala que “no resulta factible” desplazar el objeto de la investigación hacia la actuación del president, “dada su condición de aforado y que no es parte en el procedimiento”."
"Mazón, sobre el acto de Camps: “Hablar de temas internos y orgánicos ahora es irresponsable”","El president valenciano añade que para hablar de asuntos internos “habrá tiempo, pero para hablar de la reconstrucción no”, estamos cien por cien en la reconstrucción“”"
Vox impone al PP ahogar a la AVL con un recorte sin precedentes y debilitar al valenciano,"La Acadèmia perdería con las enmiendas presentadas uno de los 2,7 millones que tiene para gastos de personal y no tendría casi fondos para actividades y promoción de la lengua propia"
Ayuso lleva a los tribunales decreto de universidades de Sánchez,"La Comunidad de Madrid, a través de la Consejería de Educación, ya ha presentado alegaciones al texto&nbsp;"
Las obras para soterrar la A-5 provocan un apagón que afecta a 4.600 abonados en Batán,"El corte eléctrico, que ha perjudicado a 4.600 abonados, ha durado casi cuatro horas"
Los sindicatos piden al Defensor del Pueblo el “desalojo urgente” de los sin techo en Barajas,El sindicato Alternativa Sindical Aena/Enaire (Asae) considera que las instalaciones se han convertido en “una ciudad sin ley”
Un Air Force One de transición: así es el ansiado regalo de Qatar a Trump,"El emir Tamim bin Hamad Al Thani ya obsequió un Boeing 747-8, valorado en 500 millones de dólares, a Recep Tayyip Erdoğan"
"Josep Maria Mainat: “Soy padre soltero de dos niños con 78 años, y eso no estaba en mis planes”","Mainat, un referente de la televisión en nuestro país, es un gran aficionado a la ciencia y sigue desde años tratamientos antiaging y hábitos saludables para intetar llegar a los 120 años"
El panda gigante Ying Ying recibe regalos por el Día de la Madre en Hong Kong,El Parque Oceánico de Hong Kong preparó regalos especiales del Día de la Madre y ramos de flores para Ying Ying
"Ojo seco, miopía, presbicia o retina: así cuida tu visión IMO Grupo Miranza","Algunos problemas de visión no avisan y, por eso, el centro barcelonés dispone de un servicio de urgencias 24 horas, al que los pacientes pueden acudir presencialmente sin cita previa"
El Comité de Bioética de Catalunya propone legalizar la gestación subrogada “altruista”,El documento aviva el debate sobre los vientres de alquiler pero la Generalitat no tiene competencias para legislar sobre esta práctica
La paradoja del bienestar: por qué no es lo mismo prosperar y tener una vida plena que ser feliz,Una exhaustiva encuesta global sobre la percepción del bienestar integral de las personas arroja resultados sorprendentes: naciones en desarrollo como Indonesia o Filipinas ocupan los primeros puestos. ¿Por qué?
"Avalancha de secuelas y remakes en las salas: 'Superman', 'Misión imposible', 'Karate Kid'...",Los grandes estrenos del cine comercial se extenderán hasta final de año&nbsp;buscando el respaldo de una audiencia nostálgica
Los numerosos cráneos fragmentados de Cueva de Sangre que revelan un brutal ritual maya en Guatemala para apaciguar al dios de la lluvia,El sitio habría sido usado como lugar de sacrificio entre los años 400 antes de Cristo y 250 d.C.
Eurovisión observa a los favoritos,"Los cinco líderes de las apuestas del festival, Suecia, Austria, Francia, Israel y Bélgica, exultan en la alfombra turquesa de Basilea"
“Este año ha sido el regreso a mi contenido más puro y he vuelto a pintar”: cita con Belén Hostalet en la plaza Villa de París,"El interiorista Raúl Martins abre su casa madrileña,&nbsp; donde ha construido un universo donde el lujo es sinónimo de calma y autenticidad"
Adiós a las noches en vela: la app de DKV que quiere ayudarte a dormir más y mejor,"Es la última funcionalidad de “Quiero cuidarme más”, la aplicación de DKV que permite atención médica a través del teléfono, con consultas y servicios personalizados. Y sin listas de espera ni límite de sesiones"
“Mis padres me ayudaron a que me ayudara yo sola y lo agradezco”,"Tengo 66 años, pero el tiempo que mido y el que pasa son magnitudes diferentes. Nací en París: el sistema francés a cierto nivel es muy exigente. Casada con un sueco. Tenemos dos hijos: uno es ingeniero y el otro músico. Colaboro con CosmoCaixa, donde he intentado que más chicas estudien ciencia e ingeniería. (Foto: Ana Jiménez)"
Los nuevos drones se cuelan entre los inhibidores de señales en el frente ucraniano,Aparatos conectados por un finísimo cable de fibra óptica sustituyen a los inalámbricos pero presentan inconvenientes
La Europa oficial,
Matemático constructor de puentes,"Tras doce años de liderazgo pasional, los católicos estrenan un liderazgo clarificador"
El franquista Patronato de la Mujer: “Las gitanas no tienen solución”,La Iglesia pide perdón por ayudar a una de las instituciones más tétricas de la dictadura
¿Sabes cuánto vale tu casa? Estos son los factores clave que influyen en su precio,Ni todas las casas son iguales ni valen lo mismo. Conocer las características que determinan cuánto vale tu casa te permitirá aprovechar mejor las ofertas del mercado inmobiliario tanto para comprar como para vender
La 'brass bands' de Minnie Mouse toma la batuta musical en Disneyland París,"El parque parisino, que el próximo año inaugura 'World of Frozen', celebra hasta el 7 de septiembre el Music Festival, un homenaje a las películas que han marcado la vida de varias generaciones"
El singular Lotus que solo 60 conductores podrán tener,La versión especial Emira Clark Edition rinde homenaje al bicampeón de Fórmula 1 James Clark<br />
¿Cómo un bulo sobre aditivos sigue vivo 40 años después?,"El origen de la quimiofobia se encuentra en la controvertida lista del hospital de Villejuïf, un documento que data de los años 70 y cuya autoría se desconoce todavía hoy"
Un año después de las elecciones del 12-M,
Un Barça de PlayStation,Ahí los tenemos: un Barça que es futuro pero que ya es presente con acné
La lotería de los ocupas,"Es posible que estadísticamente el problema sea pequeño, pero políticamente es tóxico"
El aptónimo de Su Santidad,El apellido Prevost eleva el fenómeno de los aptónimos al Vaticano
Anatomía de una caída,"¿Qué prefieres, tener pelo... o tener erecciones?, ¿melena brillante o pensamientos oscuros?"
Desolación,"La soledad no deseada, que históricamente se asociaba a la vejez, ahora impregna a los jóvenes adultos"
Estados Unidos se va,Europa debe coger el testigo y liderar desde ya la construcción del nuevo orden global
"Trueta, el europeísta",El conseller Jaume Duch quiso rendir homenaje a la faceta menos conocida del doctor
Akli Sh’kk: “Rusia aprovecha la guerra de Ucrania para expandirse en el Sahel”,Asesor principal independiente del Frente de Liberación del Azawad (FLA
El PKK kurdo anuncia su disolución y depone las armas después de 40 años,"La decisión del grupo militar se produce después de que su líder encarcelado,&nbsp;Abdullah Öcalan, pidiera el desarme"
Starmer endurece la política migratoria en Reino Unido para apaciguar a la extrema derecha,"Será más difícil obtener visados para trabajar, estudiar y harán falta diez años para conseguir la nacionalidad"
En Panamá las manifestaciones contra la élite económica ya incluyen: “¡Yankis go home!”,"José Raúl Mulino, entre la espada y la pared con Trump y una oleada de protestas en defensa de la soberanía"
Salvini y Le Pen en Roma utilizan al pontífice para atacar a la UE,"La francesa se compara con Calin Georgescu, apartado de las presidenciales de Rumania por los tribunales"
Un juzgado de Barcelona investiga a dos barcos de Maersk por comercio de armas con Israel,La magistrada cita a declarar a los dos capitanes y al responsable legal de la naviera<br />
El PP acusa a Sánchez de “conocer y tapar” la corrupción y de “proteger” a Ábalos,"“El gobierno no tiene capacidad de gestionar las crisis porque está centrado en defenderse de la corrupción”, asegura&nbsp;Elías Bendodo"
Podemos apunta a Sánchez: “Es difícil de creer que no conociese los tejemanejes de Ábalos”,La formación morada asegura que el PSOE “tiene que dar muchísimas más explicaciones”
Consuelo Madrigal afirma que Puigdemont no podrá evitar su detención si vuelve a España,La exfiscal general del Estado reclama al Constitucional la máxima unanimidad para resolver sobre la amnistía
Políticos ‘business friendly’,
"Gamificación, 'headhunters', y eventos: las estrategias del cibercrimen para reclutar jóvenes",El crimen organizado necesita más hackers y ahora tiene departamentos de Recursos Humanos
El 55% de los profesionales de la ciberseguridad que se contratan en Catalunya son extranjeros,La inversión internacional en el sector se ha multiplicado por nueve en el último quinquenio
Nissan baraja recortar 10.000 empleos más en medio de su crisis,La empresa se encamina a pérdidas récord en medio de una caída de las ventas y costes al alza
Almirall triplica su beneficio gracias a sus fármacos biológicos superventas,"La farmacéutica de los Gallardo gana 21,6 millones impulsada por los productos biológicos dermatológicos<br />"
Proquimia apuesta por una química más verde,
Oughourlian afronta una junta de Prisa dividida pero con mayoría clara,Los accionistas españoles plantean una negociación para adquirir ‘El País’ y la Ser
La transformación tecnológica y la ciberseguridad industrial vuelven a Fira,El pabellón 8 acogerá a partir de mañana y hasta jueves a más de 250 expositores y cientos de ponentes nacionales e internacionales
Reabre parcialmente el polígono de la nave incendiada que causó la gran nube tóxica,
La reforma de la Rambla dejará sin floristas el paseo todo un año,El traslado provisional de las paradas a plaza Catalunya se prevé para principios de 2026 y su regreso al paseo en el 2027
Muere una niña de 8 años tras caer por el patio interior de un edificio en el barrio de Les Corts,La principal hipótesis con que trabaja la policía catalana es que la muerte fue accidental
Países Bajos: una de las mejores redes de transporte del mundo,"El viajero valida la misma tarjeta de transporte para todos los intercambios, incluido el aparcamiento de bicicletas, camina pocos minutos para los cambios intermodales y llega al destino puntualmente"
El Barça se levanta para rematar al Madrid y tiene la Liga a tiro tras un partido para la historia,El equipo barcelonista remonta un 0-2 con una primera mitad increíble y será campeón el jueves si gana en Cornellà
Adictos al riesgo,
Avance en la renovación de Flick: “Va por buen camino”,"Tras el triunfo en el clásico, Laporta, el técnico y su agente volvieron a tratar la prorrogar del contrato hasta junio del 2027"
"Szczesny: “El Barça me ha ofrecido renovar dos años, pero tengo que consultarlo con la familia”","Tras la victoria del Barça en el clásico, el portero habló para Canal+ Polonia sobre su futuro en el club"
Soto Grado pitará por primera vez el derbi catalán,El árbitro riojano ha sido designado para dirigir el partido entre el Espanyol y el Barça y contará con Iglesias Villanueva en el VAR
"Míchel: “Me detectaron una trombosis en la pierna, pero ya estoy bien”",El entrenador del Girona vuelve a la rutina para preparar el crucial partido ante el Valladolid después de pasar unos días hospitalizado
Alcaraz vence a Djere y ya está en octavos de Roma por primera vez,En el Foro Itálico tendrá que medirse ante la potente derecha del ruso Karen Khachanov
El GP de España en Montmeló aspira a una edición “excelente” para rematar la renovación,"El Circuit de Barcelona se prepara para acoger a unos 130.000 espectadores el domingo de carrera, el 1 de junio"
Sube la temperatura con estas 10 novelas eróticas que no querrás soltar,"Cuando el buen tiempo despierta los sentidos, el cuerpo pide historias que vibren como una tarde al sol. En esas situaciones, una novela erótica bien escrita es la brisa picante que nos aleja de la rutina<br />"
Los chollos del día en Amazon (12 de mayo): entre el 26% y el 51% de descuento,"Terminado el fin de semana, llega la hora de empezar la semana con fuerza tras haber recargado pilas junto a nuestros seres queridos. Una buena forma de hacerlo es consultando las grandes ofertas de Amazon"
Los 5 chollos del día en AliExpress (12 de mayo): entre el 62% y 71% de descuento,No te pierdas la ocasión de conseguir tus productos favoritos con grandes descuentos y precios irresistibles en todas las categorías
Los 10 mejores protectores solares antimanchas para el rostro,Para evitar la aparición de manchas en la cara provocadas por el sol (o reducir las que ya tenemos) es necesario aplicarse cada día una crema con un factor de protección alto
Las mejores hipotecas fijas y mixtas según Kelisto (mayo 2025),"La <a href=""https://finanzas.kelisto.es/proceso-hipoteca-ayuda?utm_content=hipoteca_fija_y_mixta&amp;utm_medium=partner&amp;utm_source=lavanguardia&amp;utm_campaign=Banco_Santander"" rel=""nofollow noreferrer sponsored"" target=""_blank"">Hipoteca fija de Banco Santander</a> (2,45% TIN) es la mejor hipoteca si buscas una a tipo fijo, mientras que la <a href=""https://finanzas.kelisto.es/proceso-hipoteca-ayuda?utm_content=hipoteca_fija_y_mixta&amp;utm_medium=partner&amp;utm_source=lavanguardia&amp;utm_campaign=Ibercaja"" rel=""nofollow noreferrer sponsored"" target=""_blank"">Hipoteca Mixta de Ibercaja</a> (1,75% TIN durante cinco años y e+0,65% el resto) es la mejor opción si buscas una a tipo mixto."
Tus invitados alucinarán con este robot limpia piscinas,Ahorra 130 euros en la compra de este modelo en Amazon con una oferta exclusiva del 19% de descuento
Guía de compra y comparativa: procesadores AMD,"Encuentra el procesador AMD ideal para ti: comparativa de modelos, especificaciones clave y consejos para elegir el mejor modelo para tus necesidades<br />"
Las 5 cuentas remuneradas más rentables: sin complicaciones,"Te mostramos 5 cuentas remuneradas con una interesante rentabilidad, que puedes contratar sin necesidad de nómina, para hacer crecer tus ahorros fácilmente<br />"
Santiago Vilanova: “La acción climática ha sido controlada por conspiradores”,El escritor sostiene en un nuevo ensayo que el gran tsunami social que supusieron el Día de la Tierra en 1970 y la toma de conciencia sobre la degradación ambiental hicieron reaccionar a los “grandes contaminadores”
Madurez en forma con bandas elásticas y curcumina,Un estudio revela que los mayores incrementan su bienestar con ejercicio de fuerza e ingiriendo a diario un antiinflamatorio y antioxidante natural&nbsp;
Una forma de pensar el mundo,
Los anuncios de comida insana llevan a los niños a consumir más calorías,Los menores de 7 a 15 años expuestos a solo 5 minutos de anuncios consumen de media 130 kilocalorías más al día
Salut amplía la red asistencial para los niños que reciben cuidados paliativos,Diez hospitales atendieron casi un millar de pacientes pediátricos el año pasado Diez hospitales atendieron casi un millar de pacientes pediátricos el año pasado
Descubre cuál de estas tres fragancias va contigo según tu personalidad,"Ser mujer es abrazar todas tus facetas y celebrar cada etapa de la vida. También elegir un perfume que evolucione contigo y saque, en cada momento, lo mejor de ti"
"El futuro de la restauración es artesanal, sostenible e inclusivo",Una cadena catalana que está marcando el camino hacia una nueva forma de entender la gastronomía
"Muchin's, un snack sin gluten para poner a Ecuador en el mapa gastronómico",Una delicia crujiente por fuera y cremosa por dentro: así son las croquetas de yuca sin gluten que traen la auténtica gastronomía ecuatoriana a la ciudad condal
Fumie Shibata: diseño entre la razón y la intuición,"La maestra del confort cotidiano que une lo mejor de Italia y Japón, reflexiona sobre diseño y comparte sus lugares favoritos del Tokio más creativo"
"Paredes al estilo 'The White Lotus': garzas, elefantes y otras obsesiones",Papeles pintados y telas que evocan la naturaleza y llenan todos los rincones con paisajes puro estilo 'The White Lotus'
La catedral de Zamora posee los mejores tapices flamencos de la edad media,"Además de sus joyas románicas y de más de 15 casas modernistas, la ciudad leonesa esconde tesoros tejidos entre los años 1450 y 1500"
"Rossy de Palma, amante del diseño: “Seamos prácticos pero dramáticos”","La actriz firma para Roche Bobois una colección cápsula audaz que fusiona teatralidad, memoria y diseño. En blanco y negro, con guiños al flamenco y al art déco, sus piezas celebran la belleza consciente y el ritual íntimo de mirarse con ternura"
“Nada hay más deprimente que una habitación sin fuego en la chimenea en un día de invierno”: lecciones de interiorismo de Edith Wharton,La preocupación por la decoración y su peso en la vida de los personajes fue constante en la obra de la escritora
La Sant Andreu Jazz Band hace que el nombre del barrio barcelonés resuene en el Met Opera,La banda juvenil barcelonesa queda segunda en el festival&nbsp;Essentially Ellington celebrado entre 30 participantes en el teatro lírico neoyorquino y varios de sus miembros reciben distinciones individuales
Milena Busquets y el miedo a no reconocer su vida en la pantalla: “Saldrá la escritora chiflada”,La escritora publica un libro que aborda el rodaje de la película de su exitosa novela ‘También esto pasará’
Reaprendiendo a jugar con Albert Camus,Las Trobades Camus reflexionan en Menorca sobre la importancia del juego en un mundo trágico
Una terna de lecturas,
Antónimo presenta en Barcelona su mejunje surreal y castizo,El ex integrante de Fondo Flamenco adelanta&nbsp;temas nuevos del inminente álbum Libélulas
Blake Lively testificará contra Justin Baldoni,Está previsto que el juicio contra el protagonista y director de la película 'Romper el círculo' se celebre el 9 de marzo del 2026
"Kai Madison, la nieta preferida de Donald Trump, cumple 18 años","La joven, que triunfa en redes como influencer y es una apasionada del golf, tiene de padrastro a Tiger Woods"
"Antonio Velázquez: “Hay un palo del flamenco, un palo a los muertos, cuyo nombre llevo años sin pronunciar”","Actor granadino forjado en teatro y protagonista en series como ‘30 monedas’, ‘La promesa’ y ‘La encrucijada’, a él se debe que la última edición de los premios Goya se celebrase en Granada"
"Gisele Bündchen comparte la primera imagen de su bebé con Joaquim Valente: “Ser madre ha sido mi mayor regalo, un viaje que me hace humilde”","La supermodelo muestra las primeras fotografías de su recién nacido, un niño , fruto de su relación con el enrenador de jiu-jitsu"
Las confesiones sexuales más estrambóticas de los famosos,"Gerard Butler, Jane Seymour, Jennifer Aniston o Robbie Williams son otras celebrities que han hablado de sus prácticas más íntimas"
Mamen García: “Mi padre tuvo un descapotable hasta que atropelló y mató a un niño o una niña”,Mamen recuerda con gran cariño su etapa como cantante de Patxinguer Z y los viajes que hacía con el grupo: “Nos pasamos 7 años actuando en cruceros”
Pedro Piqueras habla claro sobre Sara Carbonero: “Ser bellísima fue lo que peor le vino”,El antiguo presentador del telediario de Telecinco habló sobre la llegada de la periodista a la cadena
¿El arte sacro puede ser abstracto?,Un sencillo jarrón de flores puede servir de inspiración para plasmar temas como&nbsp;la Resurrección de Cristo
"La iglesia de Sant Miquel de Fluvià, una de las joyas del arte románico catalán",Este templo es el principal vestigio románico que queda en pie del antiguo monasterio benedictino de la zona
¿Las religiosas deberían tener más peso en la Iglesia católica?,"La elección del nuevo Papa es cosa solo de hombres en el cónclave de cardenales, ¿debe haber una evolución?"
Panorama de actualidad,Los profesores Melero y De España revisan la actualidad con esa gracia que Dios les ha dado
Un cadáver flota en el pantano de Cubillas,La joven Beatriz Collado fue estrangulada y lanzada a las aguas del embalse granadino en 2006 | Un albañil con antecedentes fue acusado de la muerte y él se defendió con una coartada inverosímil
Borja Poal: “Yo era adicto a todo lo que me sentase peor”,El emprendedor y artífice de&nbsp;B de Bocata protagoniza el nuevo episodio del podcast ‘Quédate a comer’
"Brutalista: más que una escuela arquitectónica o una película, todo un concepto de restaurante madrileño con el producto como bandera","Pablo López Ibarra ha desfilado por restaurantes prestigiosos como Nakeima, Tripea, La Tasquita de Enfrente y Lera, adquiriendo en todos ellos técnicas de cocina española y de fusión"
