Título,Descripción
"Coles de Bruselas con panceta al horno, una receta sencillísima que te hará enloquecer",El gratinado dará un toque delicioso a esta receta que debes guardar en tu recetario para siempre
Chiclayo entra en el mapa gastronómico con los platos favoritos del Papa León XIV,"La ciudad peruana celebra su vínculo con el Papa a través de una ruta que combina fe, historia y sabores autóctonos"
Newsletter ‘Comer’ | Borja Poal,"<a href=""https://www.lavanguardia.com/perfil/ev/login?_ref=%2Fperfil%2Fev%2Fnewsletters.html"" target=""_blank"">Apúntate aquí para recibir cada viernes el nuevo boletín sobre gastronomía de 'Comer La Vanguardia'</a>"
"Jim Rowan, ex-CEO de Volvo: “Será muy difícil implementar la conducción autónoma en entornos urbanos, donde hay obras que cambian a diario, escuelas, patinetes y niños”",El ya ex dirigente de Volvo Cars expresaba sus dudas acerca de la conducción autónoma<br />
Así puedes hacer que tu coche huela siempre bien con un ambientador caseros y barato,Una simple mezcla de vinagre con unas gotas de aceite de coco puede dejar el interior del coche libre de olores persistentes
La compacta bici urbana que busca marcar el futuro del sector,La revolucionaria y angulosa Mpact es la visión de la movilidad eléctrica del mañana de la firma Canyon<br />
Así es la práctica minicaravana ideal para tres personas,"La Sterckeman Easy 350CP combina ligereza, diseño compacto y un precio más que razonable<br />"
Del mono sabio al ciclista fisiocrómico,"Resumen de diez imágenes curiosas, de quejas o con mensaje sobre Madrid recogidas en El Buzón del Lector<br />"
Te invitamos a Automobile Barcelona 2025,Club Vanguardia sortea entre los suscriptores 80 entradas dobles para asistir a la gran feria del motor&nbsp;<br />
Encuesta: ¿Que el Papa sea estadounidense beneficiará las políticas de Trump?,"Las ideas de&nbsp;Robert Francis Prevost, León XIV, parece a las antípodas del presidente de Estados Unidos"
"Los rincones de Campdevànol, al descubierto en un libro de fotografías y reflexiones","Aúna los textos de Josep Maria Sebastian y las fotos de Joel Bares, de la Red de Lectores de 'La Vanguardia'"
"Quiero trabajar con animales, pero no sé qué estudiar: cursos y salidas laborales",Descubre las mejores opciones para hacer de tu amor por los animales una carrera exitosa&nbsp;<br />
Transforma el sistema de salud desde dentro: Fórmate y dedícate a la gestión sanitaria,"Saber organizar recursos, optimizar procesos y basar las decisiones médicas en datos precisos no solo mejora los resultados clínicos, sino que también permite anticiparse a posibles crisis"
