Título,Descripción
"La Reina Letizia, en Murcia: «En tiempos de incertidumbre tenemos que aferrarnos a la humanidad»","La monarca incluye un alegato en favor de la «humanidad» en su discurso durante la entrega de premios de Cruz Roja, celebrada en el Teatro Romea"
El Supremo se opone a la subida escalonada de los caudales ecológicos en el tramo del Tajo que afecta al Trasvase,"El Tribunal considera que esta parte del cauce está protegida, por lo que una subida progresiva de los volúmenes mínimos vulnera la directiva europea de agua"
Comunidad y Ayuntamiento alertan de posible «inestabilidad» de los desechos mineros con el sellado de Portmán,Ambas administraciones advierten del riesgo de filtraciones subterráneas de los estériles al mar si el Ministerio lleva a cabo el plan que anunció
"El PSOE reduce en 2,6 puntos su ventaja sobre el PP tras el apagón según el CIS",Los socialistas ganarían las elecciones con el 32% de los votos como refleja el barómetro correspondiente a abril
"Alcaraz - Draper, en directo",El murciano se enfrenta al estadounidense en cuartos de final
Rescatan a una mujer de 75 años al incendiarse una vivienda en Murcia,El fuego se originó en un segundo piso de un edificio de la plaza Yesqueros
Cataluña investiga qué falló en el caso de la víctima de una red de pederastia,Hay una treintena de hombres bajo investigación ante la sospecha de que conformaran una red de pederastia que presuntamente abusó de 25 menores
Aemet activa el aviso amarillo por tormentas en la Región para este jueves,Meteorología advierte de que las precipitaciones pueden ir acompañadas de granizo
"El escritor Eduardo Mendoza, Premio Princesa de Asturias de las Letras: «Soy un hombre feliz»","El escritor barcelonés corona su brillante trayectoria en el cincuenta aniversario de su primera obra, 'La verdad sobre el caso Savolta'"
Hasta 230 empresas familiares reciben la ayuda del 99% para la transmisión del negocio en la Región,"Las medidas fiscales del Gobierno autonómico han permitido alcanzar esta cifra en los últimos dos años, según se ha expuesto este miércoles durante las Jornadas Tributarias"
El Rey Felipe VI visitará el submarino S-81 'Isaac Peral' en Cartagena el próximo lunes,"El monarca acudirá al Arsenal Militar para conocer el navío antes de su puesta en funcionamiento, el próximo julio"
La CHS trabaja en recuperar el bosque de ribera nativo en el entorno del río Argos,El organismo de cuenca avanzar en las actuaciones de restauración ambiental del cauce a su paso por Cehegín
Murcia albergará el 24 de mayo un nuevo concierto secreto del movimiento Sofar Sounds,"La emblemática marca, presente en más de 400 ciudades de todo el mundo, mantendrá ocultos el cartel y la ubicación especial hasta 48 horas antes de la celebración"
"El Gobierno confirma que el apagón se originó en Granada, Badajoz y Sevilla",La ministra Sara Aagesen pone el foco en las oscilaciones que ocurrieron media hora antes de la desconexión total y descarta que se debiera a un problema de cobertura o a un ciberataque
'Fan zone' y entradas a 10 euros para ver la fase de ascenso a la ACB del Cebé Cartagena,El equipo albinegro está a cinco partidos de subir a la máxima categoría y este viernes en Sevilla afronta el primero contra el Betis
El Supremo rechaza el intento de Koldo de frenar la investigación de la UCO sobre los supuestos amaños de obra pública,El instructor desestima el recurso del exasesor de Ábalos e insiste en que esta causa ya no solo versa sobre la compra de mascarillas
Detienen a un conductor que arrolló a una motorista y se dio a la fuga en Murcia,"La mujer resultó herida de gravedad como consecuencia del impacto, que ocurrió en la rotonda conocida como Isla Grossa"
La Justicia de EE UU abre la puerta a la libertad condicional de los hermanos Menéndez tras rebajar su condena,"Lyle y Erik, que asesinaron a sus padres en 1989, han visto reducida su cadena perpetua a 50 años, de los que ya han cumplido 35"
Las protestas se recrudecen en Navantia por la falta de avance en las negociaciones y el incumplimiento reiterado del convenio,Efectivos de la Guardia Civil se han personado en la entrada de la factoría en Cartagena por una denuncia que decía que no se le deja acceder a su puesto de trabajo
Estas son todas las actividades en la Región por el Día de los Museos,"La programación reúne esta semana exposiciones temporales, pintura en directo, talleres didácticos y visitas guiadas"
Nueve españoles retenidos en un hotel de Trípoli debido a los combates entre guerrillas,"El grupo llegó el lunes en misión comercial a la capital libia, donde el asesinato del líder de una milicia ha desatado intensos combates entre facciones rivales"
Jordi González revela que ha estado a punto de morir a causa de una bacteria,Fueron necesarias tres semanas en coma inducido y una traqueotomía para salvarle la vida
Comienza la rehabilitación de la Torre Alfonsina de Lorca con una inversión de 600.000 euros,"Se mejorará la accesibilidad en el monumento, que recibe 80.000 visitas al año"
Conceden a un maquinista de Renfe el traslado geográfico por conciliación,"El TSJ estima que «cuando está en juego el interés de los menores, sus derechos exceden del ámbito estrictamente privado»"
Telefónica pierde 1.304 millones hasta marzo por la venta de Argentina y Perú,"Los primeros resultados con Marc Murtra al frente reflejan unos ingresos un 9% inferiores a los del primer trimestre de 2024, hasta los 9.221 millones, pero confirman un dividendo de 0,30 por acción"
El Ayuntamiento de Molina adquiere un local en la plaza de la Región Murciana para la nueva comisaría de Policía Local,"El alcalde, José Ángel Alfonso, destaca que «nos permitirá reforzar la presencia policial, mejorar la atención vecinal y dinamizar una de las zonas más vivas del municipio»"
HoyTú advierte de que Murcia puede perder en pocos años la mitad de su ocio nocturno,"La patronal pone en marcha una campaña para pedir la derogación de las restricciones establecidas para las calles de menos de siete metros, ya que 17 de los 34 pubs de la ciudad se ven afectados"
Suecia pasa a la final de Eurovisión en una noche marcada por Melody y la eliminación de Bélgica,"Eslovenia, Bélgica, Azerbayán, Croacia y Chipre han sido los países eliminados en la primera semifinal del concurso"
Un ejército de mariquitas para combatir las plagas en los huertos de ocio de Murcia,Más de 2.800 ejemplares lucharán contra el pulgón en 11 fincas como medida de control sostenible
"«Adiós amigo», «viejo querido»: el mundo llora la muerte de Pepe Mujica",Las reacciones de solidaridad y recuerdos del exmandatario uruguayo se han multiplicado tras conocerse este martes su fallecimiento
"La ayuda para comprar gafas, audífonos o realizar reparaciones en viviendas que se puede solicitar hasta el 4 de junio","Los beneficiarios de estas ayudas serán las personas mayores de 65 años, pensionistas de la Seguridad Social, en cualquiera de sus modalidades, o su cónyuge"
El acusado de matar a puñaladas a un joven en Cartagena ya declara ante la jueza,"Varios testigos aseguran que el agresor llevaba un arma blanca que la víctima trató de arrebatarle y que «al intentar quitarle el cuchillo, se lo clavó»"
«El balneario con alma de Alhambra»: así describe National Geographic uno de los grandes atractivos turísticos de la Región de Murcia,"Esta revista destaca la historia de este enclave, conocido por sus aguas termales"
La inflación baja una décima en abril en la Región y se mantiene como la más baja de España,"El IPC en la Comunidad es del 1,5%, 0,7 puntos por debajo de la media nacional"
A prisión el jefe del 'chalé' de La Paz por liderar el secuestro de un joven en Murcia,"La víctima aseguró que trabajaba para el traficante y que, tras gastarse un dinero en un salón de juegos, este le amenazó con cortarle el dedo con un machete"
Feijóo espeta a Sánchez «váyase» y el presidente cuestiona su liderazgo en el PP,El líder de la oposición recurre a los wasaps del jefe del Ejecutivo con Ábalos y le insta a «ahorrarse el bochorno» mientras el socialista le acusa de entretenerse con «casquería» y augura otro fracaso en 2027
Cannes homenajea a De Niro: «Trump está intentando salvar a América y salvar su culo»,Los discursos feministas y en contra de Donald Trump marcan el acto inaugural del certamen en el que entregan la Palma de Oro Honorífica a la estrella estadounidense
El resurgir de las ferreterías tras el apagón,El reciente corte masivo de electricidad pone en valor estos negocios de toda la vida: «La gente le ha visto las orejas al lobo y la venta no ha parado por si vuelve a pasar»
Los alumnos murcianos siguen siendo los que más repiten curso en España,"La tasa regional disminuye con respecto a años anteriores, pero se mantiene por encima de la media"
Cuatro caras para una venta en el Efesé,"Felipe Moreno, Fernando Carreño, Andrés López y Belmonte tienen la llave para ponerse de acuerdo y desatascar el futuro del club cuanto antes"
"Jesús Cruz Villalón: «La jornada laboral de 37,5 horas va a ser un desafío para la negociación»","El jurista andaluz resalta que en la Región la subida del SMI «afecta a sectores de mucha influencia, como agricultura, comercio y hostelería»"
Los vecinos del litoral sur del Mar Menor piden más mantenimiento en playas y calles,"Los Nietos reclama una reforma en el paseo, Los Urrutias otro balneario y Mar de Cristal más podas en zonas verdes y reposición de farolas"
La granizada provocará más de 60 millones de pérdidas en la agricultura,Los productores señalan que el pedrisco arrasó 22.200 hectáreas de cultivos y cuantifican en miles los empleos destruidos
"El Real Murcia, con un ojo en el Ibiza y otro en el Nástic","Si el equipo grana logra acabar segundo, podría cruzarse en el 'playoff' con el equipo catalán, que hace once meses se quedó sin ascenso en un final dramático"
«Hemos constatado que hay mucho miedo a la palabra feminismo»,El festival de literatura Demoleer celebra este sábado su segunda edición con Belén Gopegui y Gabriela Wiener en la Biblioteca Regional
Nuevo retiro lector en caravana en la playa de Parazuelos por el centenario de 'La señora Dalloway' de Virginia Woolf,"Tendrá lugar los días 30 y 31 de mayo y 1 de junio en la bahía de Mazarrón, y asistirán como ponentes Itziar Hernández Rodilla, traductora de Virginia Woolf; Ana Flecha Marco, escritora, traductora y editora, y Cristina Consuegra, comisaria, creativa y crítica cultural; LA VERDAD sortea entre sus suscriptores cinco pases dobles para acceder a la jornada del sábado 31"
"El Ayuntamiento de Murcia usará 1,5 millones de proyectos no ejecutados en 2024","La reordenación de las partidas de Deportes de este ejercicio impulsa el arreglo del campo de fútbol del Barnés, con unos 300.000 euros"
Ferrovial triplica su resultado operativo hasta los 496 millones,"La compañía, que repartirá un dividendo flexible de 228 millones de euros el 25 de junio, no ofrece su dato neto al tratarse del balance trimestral y solo hacerlo en el semestral"
"Enrique Nieto, pintor con verdad",
Destituido el director de la Escuela de Industriales de la UPCT para «facilitar las elecciones»,El rector defiende que «no es un cese al uso» porque Franco Chumillas ya había acabado su mandato en febrero
Satse teme otro verano de cierre de camas hospitalarias en Orihuela,El sindicato de enfermería sospecha que se puede producir una situación parecida al año pasado «para ahorrar en personal»
Las obras de los principales parques del centro de Orihuela suman más retrasos,El PSOE denuncia falta de planificación en la renovación integral de las instalaciones infantiles de la Glorieta Gabriel Miró y Severo Ochoa
Excelencia e innovación en urología: Ribera Hospital de Molina lidera el uso de láser en la Región de Murcia,
Euromillones: Comprobar resultados de hoy martes 13 de mayo de 2025,"La combinación ganadora del sorteo es 9, 19, 44, 47 y 50; y las estrellas los números 2 y 9"
Bonoloto: Comprobar resultados del sorteo de hoy martes 13 de mayo de 2025,"La combinación ganadora del sorteo de la Bonoloto ha sido para los números 12, 16, 18, 22, 31 y 45"
Eurojackpot: Comprobar resultados del sorteo del martes 13 de mayo de 2025,"Los números premiados fueron el 13, 16, 19, 33 y 34, y los soles han ido a parar a los números 5 y 12"
ONCE: Comprobar resultados del sorteo del martes 13 de mayo de 2025,"En el sorteo del cupón diario de la ONCE de hoy martes 13 de mayo de 2025, ha resultado premiado el número 12087, serie 18"
El gobierno de Trump redobla los ataques a Harvard,El castigo federal a su resistencia suma ya 2.650 millones de dólares
Vandalizan la verja de la puerta de entrada del cine Rex de Murcia,Los propietarios del inmueble cambian este elemento por otro más resistente; Huermur logra la inclusión de la sala en la Lista Roja del Patrimonio
UGT advierte de que las camas seguirán en los pasillos hasta que abran dos plantas del Rosell,"A pesar de la apertura de la sala de terapias cortas, en Urgencias del hospital Santa Lucía había este martes 23 pacientes esperando para ser ingresados"
Arabia Saudí se gana a Trump con la mayor compra de armamento de la historia,Riad le dispensa un recibimiento de rey en la primera etapa de un ambicioso viaje del presidente de EE UU por Oriente Medio
El bocadillo murciano que se cuela en el cuarto puesto del Campeonato de España de Bocatas,Un restaurante de la Región se lleva el primer puesto en la categoría 'Delivery'
Prisión provisional para los cinco detenidos por secuestrar a un joven con un arma blanca en una cafetería de Murcia,"Cuando la Policía Local interceptó el vehículo en el que viajaban los sospechosos, localizaron a la víctima con lesiones"
Kardashian comparece en el juicio en París por su espectacular atraco : «Pensé que iba a morir»,La famosa estadounidense ha declarado en el proceso por el robo de 9 millones de euros que sufrió en 2016 por una banda de delincuentes ancianos en un hotel de lujo en la capital francesa
La caída de la rentabilidad desinfla el boom de las letras entre los pequeños inversores,"El interés ofrecido se consolida por debajo del 2% y no cubre el impacto de la inflación. Los particulares pasan de copar el 38% del mercado al 31,59%"
"Carlos Alcaraz, obsesionado con la película 'Gladiator' en Roma",El tenista murciano ha logrado pasar a cuartos de final este martes en el Masters 1000 de la capital italiana
Fallece un segundo herido por la explosión en un laboratorio clandestino de marihuana en Espinardo,"La deflagración, ocurrida el pasado mes de enero, se habría originado durante un proceso de extracción de aceite de hachís con gas butano en una vivienda del barrio del Espíritu Santo"
"Dos turistas alemanas, detenidas por exhibicionismo y conducción temeraria en Murcia","Las mujeres fueron captadas por un conductor mientras una de ellas se masturbaba en la calle, junto a una camioneta, mientras la otra la grababa con un teléfono móvil"
La confesión de Frank Cuesta: «No tengo cáncer» y «los animales han sido comprados»,"El presentador ha cedido al chantaje de su excolaborador, Chi, a cambio de que le retire las denuncias"
Así es el Air Force One de lujo que Catar regalará a Trump,"El Boeing 747-8 cuesta unos 375 millones y tendrá una enorme suite presidencial, quirófano, gimnasio, salón de reuniones, capacidad para cien personas y un completo sistema de seguridad"
Estas son las calles que se quedarán sin luz esta semana en la Región de Murcia,Iberdrola interrumpirá el suministro para realizar labores de mantenimiento y reparar averías
Cuenta atrás para pagar el IBI de tu casa en la Región: consulta la fecha de tu localidad,Este impuesto es obligatorio para todos los propietarios de una vivienda
¿Se puede vivir sin coche en tu barrio? 'Spoiler': lo más probable es que no,Solo uno de cada cinco habitantes de la Región de Murcia tiene acceso a todos los servicios esenciales a 15 minutos a pie. Comprueba la situación de tu calle en un mapa interactivo
Vecinos de la costa de Orihuela insisten en pedir la limpieza de ramblas,Advierten al Consistorio de la proliferación de olores y plagas de insectos y del peligro de incendios como el ocurrido el domingo
La UMH investirá a los exministros Lamo y Pimentel como doctores 'honoris causa',
La Primitiva: Comprobar resultados del sorteo del lunes 12 de mayo de 2025,"Los números premiados de hoy son 5, 10, 33, 35, 44 y 48"
Bonoloto: Comprobar resultados del sorteo de hoy lunes 12 de mayo de 2025,"La combinación ganadora del sorteo de la Bonoloto ha sido para los números 4, 14, 16, 21, 23 y 29"
Los datos que explican por qué las entradas son más caras que nunca,Los eventos musicales en directo continúan alcanzando anualmente picos históricos de ganancias directamente relacionados con un aumento de costes y mayor producción
VW Huertas Motor impulsa la electrificación logística de Auxiliar Conservera,Esta colaboración refuerza el compromiso de ambas compañías con el transporte limpio y la innovación en el sector industrial murciano
Renault 4 E-Tech eléctrico: Una leyenda enchufada al futuro,
Mazda celebra 25 años en España con la apertura de su 'Crafted in Japan House',
"El alquiler se prepara para la temporada y aumenta sus matriculaciones un 12,8% en abril",
"Montjuïc, medio siglo sin carreras","Montjuic. Domingo 27 de abril de 1975. Rolf Stommelen, al volante del Hill F1 GH- Ford Cosworth lidera el Gran Premio de España de F1 desde hace nueve vueltas"
La tenista española Paula Badosa se convierte en nueva embajadora de Lexus,La firma automovilística japonesa refuerza su vínculo con el tenis de alto nivel al que se une un deportista que inspira dentro y fuera de las pistas
"Qué llevar, cómo colocar y viajar con equipaje en moto","Además de las maletas, también es recomendable contar con una mochila y un pulpo o red, ya que son elementos que aumentarán la capacidad de carga, aportando una gran comodidad durante tu viaje"
